precio|enlace|descripcion|area|habitaciones|banios|pais|localidad|region|direccion|latitude|longitude
$ 80,000|/inmueble/c3c5-9ac5-300dab6-fdfb25142e33-490e|Terreno en  Mariscal Caceres, San Juan De Lurigancho, Perú||||PE|San Juan de Lurigancho, Lima|Lima Departamento|Mariscal Caceres, San Juan De Lurigancho, Perú|-11.9475252|-76.98009909999999
$ 978,380|/inmueble/426539|Terreno en  Cieneguilla, Lima|4,270m2|||PE|Cieneguilla, Lima|Lima Departamento||-12.138236|-76.824234
$ 78,000|/inmueble/453441|Terreno en  Asia, Cañete|279.4m2|||PE|Asia, Cañete|Lima Departamento||-12.7387|-76.630624
$ 4,050,000|/inmueble/142659|Terreno en  Urb. Los Granados Surco, Santiago De Surco, Lima, Lima, Peru||||PE|Santiago de Surco, Lima|Lima Departamento|Urb. Los Granados Surco, Santiago De Surco, Lima, Lima, Peru|-12.150294|-76.938884
$ 185,000|/inmueble/5d4e-884a-40dddf33-167020319058-32c2|Terreno en  Chorrillos, Lima||||PE|Chorrillos, Lima|Lima Departamento||-12.177324|-77.014442
$ 85,000|/inmueble/384494|Terreno en  Jicamarca Anexo 8, Lurigancho-chosica, Peru||||PE|Chosica, Lima|Lima Departamento|Jicamarca Anexo 8, Lurigancho-chosica, Peru|-11.9835509|-76.944141
$ 30,000|/inmueble/360404|Terreno en  Ancon, Lima|90m2|||PE|Ancon, Lima|Lima Departamento||-11.7690615|-77.16720939999999
$ 85,000|/inmueble/441607|Terreno en  Av. La Mar 315, Asia 15689, Perú||||PE|Asia, Cañete|Lima Departamento|Av. La Mar 315, Asia 15689, Perú|-12.778461198386795|-76.55684192209014
$ 30,000|/inmueble/360392|Terreno en  Ancon, Lima|90m2|||PE|Ancon, Lima|Lima Departamento||-11.7690615|-77.16720939999999
$ 4,598,000|/inmueble/322348|Terreno en  Av. Santo Domingo De Olleros Km 3.5, Chilca, Cañete, Lima, Peru||||PE|Santo Domingo De Los Olleros, Huarochiri|Lima Departamento|Av. Santo Domingo De Olleros Km 3.5, Chilca, Cañete, Lima, Peru|-12.2179111|-76.5148607
$ 260,000|/inmueble/486599|Terreno en  Magdalena Del Mar, Lima||||PE|Magdalena del Mar, Lima|Lima Departamento||-12.0941359|-77.07031599999999
$ 4,500,000|/inmueble/477432|Terreno en  Cercado De Lima, Lima||||PE|Cercado de Lima, Lima|Lima Departamento||-12.0630912|-77.0178456
$ 350,000|/inmueble/477531|Terreno en  Salaverry Et.2, Lima||||PE|Salaverry Et.2, Jesus Maria, Lima|Lima Departamento||-12.0774995|-77.048833
$ 23,882.28|/inmueble/7037-a676-d4ce32b1-cbec90fdf6bd-4aa5|Terreno en  Independencia, Leoncio Prado, Lima, Perú||||PE|San Antonio, Miraflores, Lima|Lima Departamento|Independencia, Leoncio Prado, Lima, Perú|-12.1393814|-76.960986
$ 325,000|/inmueble/f889-bd67-f11854a0-abab917fac70-3d90|Terreno en  Villa El Salvador, Lima||||PE|Villa El Salvador, Lima|Lima Departamento||-12.203555|-76.934206
$ 105,000|/inmueble/25ad-a71b-d92cbdad-2006acdaddac-385e|Terreno en  Cercado De Lima, Lima||||PE|Cercado de Lima, Lima|Lima Departamento||-12.260809|-76.884048
$ 10,000,000|/inmueble/a9d4-93be-accdf910-1cd2f3773652-30f5|Terreno en  San Juan De Lurigancho, Lima||||PE|San Juan de Lurigancho, Lima|Lima Departamento||-11.96893|-76.993984
$ 115,000|/inmueble/562196|Terreno en  Cordillera Negra 214, Chorrillos 15057, Perú||||PE|Chorrillos, Lima|Lima Departamento|Cordillera Negra 214, Chorrillos 15057, Perú|-12.192013680284287|-76.99549498098145
$ 33,937.97|/inmueble/570848|Terreno en  Acceso A Sta. Rosa 480, Santa Rosa 15123, Perú||||PE|Santa Rosa, Lima|Lima Departamento|Acceso A Sta. Rosa 480, Santa Rosa 15123, Perú|-11.796908685522192|-77.17980283241576
$ 320,000|/inmueble/596119|Terreno en  Av. Enrique Meiggs 2340, Cercado De Lima 15081, Perú||||PE|Cercado de Lima, Lima|Lima Departamento|Av. Enrique Meiggs 2340, Cercado De Lima 15081, Perú|-12.037998669074636|-77.07181928027039
$ 176,000|/inmueble/6793-9318-1831002c-c6b578c4e441-4f09|Terreno en  Santa Cruz De Tenerife 406, La Molina, Lima, Perú||||PE|Rinconada Baja, La Molina, Lima|Lima Departamento|Santa Cruz De Tenerife 406, La Molina, Lima, Perú|-12.1048273|-76.9433134
$ 800,000|/inmueble/3b95-87da-f6841b1f-12335e858fcb-325d|Terreno en  Barranca Distrito, Barranca||||PE|Barranca Distrito, Barranca|Lima Departamento||-10.744038|-77.765006
$ 100|/inmueble/7a80-80b7-d7ed89c7-b453272ec5d0-30d2|Terreno en  Chancay, Huaral||||PE|Chancay, Huaral|Lima Departamento||-11.5760968|-77.2625348
$ 235,000|/inmueble/6267-9e7d-d28aedc0-7a021f5d8436-3607|Terreno en  Cercado De Lima, Lima||||PE|Cercado de Lima, Lima|Lima Departamento||-12.209534|-76.853875
$ 62,000|/inmueble/7387-9099-cc978e81-ba4f21c8fba7-3f61|Terreno en  Chosica, Lima||||PE|Chosica, Lima|Lima Departamento||-11.969107|-76.699017
$ 83,000|/inmueble/b63f-92f3-a220055c-4488fc6c605-3214|Terreno en  Chaclacayo, Lima||||PE|Chaclacayo, Lima|Lima Departamento||-11.994764|-76.768278
$ 90,000|/inmueble/d06d-a6e2-35b4df76-600b3efd936f-3515|Terreno en  Carabayllo, Lima||||PE|Carabayllo, Lima|Lima Departamento||-11.841246|-77.044573
$ 63,000|/inmueble/8210-9fc1-19fabf19-7906c57bd249-4032|Terreno en  San Juan De Lurigancho, Lima||||PE|San Juan de Lurigancho, Lima|Lima Departamento||-11.998462|-76.853493
$ 1,300,000|/inmueble/e91f-b235-e3835809-c12c430c047a-4328|Terreno en  La Planicie, La Molina, Perú||||PE|La Planicie, La Molina, Lima|Lima Departamento|La Planicie, La Molina, Perú|-12.0756385|-76.9110056
$ 900,000|/inmueble/ffe3-9a64-89b6396a-510ac191c492-469d|Terreno en  La Planicie, La Molina, Perú||||PE|La Planicie, La Molina, Lima|Lima Departamento|La Planicie, La Molina, Perú|-12.0756385|-76.9110056
$ 530,000|/inmueble/452413|Terreno en  La Planicie, La Molina, Perú||||PE|La Planicie, La Molina, Lima|Lima Departamento|La Planicie, La Molina, Perú|-12.0756385|-76.9110056
$ 190,800|/inmueble/519511|Terreno en  Calle San Luis, Chorrillos, Peru|240m2|||PE|Chorrillos, Lima|Lima Departamento|Calle San Luis, Chorrillos, Peru|-12.1915532|-77.00864229999999
$ 262,000|/inmueble/563293|Terreno en  Vulcano, Santiago De Surco 15054, Perú||||PE|Santiago de Surco, Lima|Lima Departamento|Vulcano, Santiago De Surco 15054, Perú|-12.1673686|-76.9945306
$ 1,000,000|/inmueble/98e-a81a-84098785-5370ab5411f1-3db5|Terreno en  Country Club, Lima||||PE|Country Club, San Isidro, Lima|Lima Departamento||-12.091562|-77.051474
$ 467,550|/inmueble/454843|Terreno en  Antigua Panamericana Sur 90, Pachacamac 15823, Perú||||PE|Lurin, Lima|Lima Departamento|Antigua Panamericana Sur 90, Pachacamac 15823, Perú|-12.264|-76.882
$ 36,000|/inmueble/552721|Terreno en  Av. Túpac Amaru 670, Carabayllo 15319, Perú||||PE|Carabayllo, Lima|Lima Departamento|Av. Túpac Amaru 670, Carabayllo 15319, Perú|-11.852202518261265|-77.00183699309844
$ 3,600,000|/inmueble/320128|Terreno en  La Planicie, 1a Etapa, La Molina, Lima, Lima, Peru|3,690m2|||PE|La Planicie, La Molina, Lima|Lima Departamento|La Planicie, 1a Etapa, La Molina, Lima, Lima, Peru|-12.0754089|-76.9079896
$ 249,000|/inmueble/9f0c-b24f-2f24bf51-8bb415d7b029-3a41|Terreno en  Villa El Salvador, Lima||||PE|Villa El Salvador, Lima|Lima Departamento||-12.23216|-76.937939
$ 4,000,000|/inmueble/300476|Terreno en  Avenida Circunvalación Golf Los Incas, Surco, Perú||||PE|Santiago de Surco, Lima|Lima Departamento|Avenida Circunvalación Golf Los Incas, Surco, Perú|-12.0884602|-76.9670491
$ 36,000|/inmueble/5fab-8261-2865b15f-3214d3e70c1c-3242|Terreno en  San Miguel, Lima||||PE|San Miguel, Lima|Lima Departamento||-12.222211|-76.915653
$ 580,000|/inmueble/422552|Terreno en  Molina Plaza, La Molina, Lima, Lima, Peru||||PE|Camacho, La Molina, Lima|Lima Departamento|Molina Plaza, La Molina, Lima, Lima, Peru|-12.0911401|-76.9502629
$ 2,000,000|/inmueble/554027|Terreno en  San Juan De Lurigancho, Lima||||PE|San Juan de Lurigancho, Lima|Lima Departamento||-11.9763301|-76.99422109999999
$ 220,000|/inmueble/3bfb-8f22-23a68006-7184b5dff2c8-1273|Terreno en  Av. Cajamarquilla, Lima, Perú||||PE|Pando, San Miguel, Lima|Lima Departamento|Av. Cajamarquilla, Lima, Perú|-12.022153|-76.9933199
$ 300,000|/inmueble/474918|Terreno en  Parque Colmenares, Parque Colmenares, Pueblo Libre, Perú||||PE|Pueblo Libre, Lima|Lima Departamento|Parque Colmenares, Parque Colmenares, Pueblo Libre, Perú|-12.0798814|-77.0695217
$ 337,500|/inmueble/374890|Terreno en  Carabayllo, Lima||||PE|Carabayllo, Lima|Lima Departamento||-11.8180134|-77.0780316
$ 180,000|/inmueble/455353|Terreno en  Pucusana, Lima|400m2|||PE|Pucusana, Lima|Lima Departamento||-12.468815|-76.789282
$ 260,000|/inmueble/455348|Terreno en  Pucusana, Lima|450m2|||PE|Pucusana, Lima|Lima Departamento||-12.467411|-76.787029
$ 25,000|/inmueble/f30d-8a23-fa41c291-37f833ba7502-384a|Terreno en  Hualmay, Huaura||||PE|Hualmay, Huaura|Lima Departamento||-11.088343|-77.610651
$ 160,000|/inmueble/f9b3-9373-f7284d8a-931187e11e78-3957|Terreno en  San Martin De Porres, Lima||||PE|San Martin de Porres, Lima|Lima Departamento||-11.969394|-77.097095
$ 120,000|/inmueble/e9b2-a030-f4d2c14c-9221243e4f46-3444|Terreno en  Huacho, Huaura||||PE|Huacho, Huaura|Lima Departamento||-11.127154|-77.596864
$ 1,800,000|/inmueble/467029|Terreno en  691, Cercado De Lima 15082, Perú||||PE|Aurora, Miraflores, Lima|Lima Departamento|691, Cercado De Lima 15082, Perú|-12.046373|-77.042754
$ 50,000|/inmueble/e555-a3fc-e42286a5-41a1bafccad8-3a60|Terreno en  Ancon, Lima||||PE|Ancon, Lima|Lima Departamento||-11.776523|-77.18554
$ 280,000|/inmueble/dc1b-903b-e030a212-c1b271a17f7d-31a7|Terreno en  Cercado De Lima, Lima||||PE|Cercado de Lima, Lima|Lima Departamento||-12.141151|-77.022119
$ 700,000|/inmueble/8577-9826-dd177712-1cff11223120-3f38|Terreno en  Villa Maria Del Triunfo, Lima||||PE|Villa Maria del Triunfo, Lima|Lima Departamento||-12.183333|-76.933333
$ 90,000|/inmueble/8307-93f0-db6a4277-2348faece423-3a79|Terreno en  San Juan De Lurigancho, Lima||||PE|San Juan de Lurigancho, Lima|Lima Departamento||-11.986193|-77.011658
$ 62,000|/inmueble/8c1c-a59c-b9d7b841-131e29cd0126-3701|Terreno en  Carabayllo, Lima||||PE|Carabayllo, Lima|Lima Departamento||-11.841246|-77.044573
$ 30,000|/inmueble/86b8-a6ef-ae6f495d-13e499472315-30d0|Terreno en  Hualmay, Huaura||||PE|Hualmay, Huaura|Lima Departamento||-11.087341|-77.602236
$ 65,000|/inmueble/c39e-9dbe-ab55c04c-9ce3a5c58146-3ccb|Terreno en  Carabayllo, Lima||||PE|Carabayllo, Lima|Lima Departamento||-11.840461|-77.074734
$ 750,000|/inmueble/396567|Terreno en  La Molina, La Molina, Lima, Lima, Peru||||PE|La Planicie, La Molina, Lima|Lima Departamento|La Molina, La Molina, Lima, Lima, Peru|-12.0820196|-76.928234
$ 60,000|/inmueble/dbf1-bee8-97cb91be-e653c1b36e5d-3753|Terreno en  San Juan De Miraflores, Lima||||PE|San Juan de Miraflores, Lima|Lima Departamento||-12.148931|-76.960623
$ 60,000|/inmueble/54dc-a4c7-8fa013a9-c1cf607c4f7d-3e7b|Terreno en  Huacho, Huaura||||PE|Huacho, Huaura|Lima Departamento||-11.122722|-77.610568
$ 50,000|/inmueble/430e-8878-8a4a19e6-de69a83a2bb0-369e|Terreno en  Ancon, Lima||||PE|Ancon, Lima|Lima Departamento||-11.776523|-77.18554
$ 390,304|/inmueble/f80-bdfa-2127ffa9-f942740a704f-36e2|Terreno en  Huacho, Huaura||||PE|Huacho, Huaura|Lima Departamento||-11.095959|-77.594581
$ 1,843,600|/inmueble/c1fe-9205-209ff71e-b91b6d95eafa-3557|Terreno en  Santiago De Surco, Lima||||PE|Santiago de Surco, Lima|Lima Departamento||-12.096471|-77.009702
$ 55,000|/inmueble/591783|Terreno en  San Antonio - Carabayllo, Carabayllo, Perú||||PE|Carabayllo, Lima|Lima Departamento|San Antonio - Carabayllo, Carabayllo, Perú|-11.8612218|-77.0463719
$ 45,000|/inmueble/8af8-9dcf-385032f2-95b41905ef15-33b6|Terreno en  Pachacamac, Lima||||PE|Pachacamac, Lima|Lima Departamento||-12.237134|-76.888339
$ 360,000|/inmueble/c7ca-8c33-a665d2fc-28ff1b792151-3d67|Terreno en  Villa El Salvador, Lima||||PE|Villa El Salvador, Lima|Lima Departamento||-12.220164|-76.970212
$ 10,500,000|/inmueble/603064|Terreno en  Lurín, Perú||||PE|Lurin, Lima|Lima Departamento|Lurín, Perú|-12.2608092|-76.8840477
$ 50,500|/inmueble/454631|Terreno en  Villa Los Ingenieros, Lurigancho-chosica, Perú||||PE|Chosica, Lima|Lima Departamento|Villa Los Ingenieros, Lurigancho-chosica, Perú|-11.9992004|-76.8711381
$ 654,000|/inmueble/557354|Terreno en  La Victoria, Lima||||PE|La Victoria, Lima|Lima Departamento||-12.064927|-77.031924
$ 450,000|/inmueble/364412|Terreno en  Rinconada Del Lago, La Molina, Lima, Lima, Peru||||PE|Rinconada Baja, La Molina, Lima|Lima Departamento|Rinconada Del Lago, La Molina, Lima, Lima, Peru|-12.0959037|-76.9254134
$ 900,000|/inmueble/362676|Terreno en  La Planicie, La Molina, Lima, Lima, Peru|1,135m2|||PE|La Planicie, La Molina, Lima|Lima Departamento|La Planicie, La Molina, Lima, Lima, Peru|-12.0756385|-76.9110056
$ 650,000|/inmueble/471297|Terreno en  Interior 29-30, Jr. Franklin D. Roosevelt 923, Santiago De Surco 15063, Perú||||PE|Santiago de Surco, Lima|Lima Departamento|Interior 29-30, Jr. Franklin D. Roosevelt 923, Santiago De Surco 15063, Perú|-12.147131271696082|-77.0138617604971
$ 11,250,000|/inmueble/567027|Terreno en  Santa María Del Mar, Perú||||PE|Santa Maria del Mar, Lima|Lima Departamento|Santa María Del Mar, Perú|-12.4058611|-76.7743383
$ 78,000|/inmueble/ff32-bb5f-45390023-426f3588f73b-3163|Terreno en  Santiago De Surco, Lima||||PE|Santiago de Surco, Lima|Lima Departamento||-12.046374|-77.0427934
$ 450,000|/inmueble/374879|Terreno en  La Chalana, La Molina, Peru||||PE|La Planicie, La Molina, Lima|Lima Departamento|La Chalana, La Molina, Peru|-12.081849|-76.9152806
(Precio a consultar)|/inmueble/467207|Terreno en  Condominio Fundo Pradera, 1s, Asia, Perú||||PE|Asia, Cañete|Lima Departamento|Condominio Fundo Pradera, 1s, Asia, Perú|-12.7188391|-76.6115935
$ 5,500|/inmueble/382302|Terreno en  Av. Princiapl, Barranco, Lima, Lima, Peru|2,998m2|||PE|Surquillo, Lima|Lima Departamento|Av. Princiapl, Barranco, Lima, Lima, Peru|-12.1171238|-77.0060285
$ 1,218,184|/inmueble/426387|Terreno en  Av. Costanera 2970, Cercado De Lima 15087, Perú||||PE|Maranga, San Miguel, Lima|Lima Departamento|Av. Costanera 2970, Cercado De Lima 15087, Perú|-12.0787837|-77.11019879999999
$ 95,000|/inmueble/567013|Terreno en  Urbanización San Carlos Bajo, Cercado De Lima, Perú||||PE|Pachacamac, Lima|Lima Departamento|Urbanización San Carlos Bajo, Cercado De Lima, Perú|-12.2270392|-76.8460491
$ 172,047.43|/inmueble/410f-9a2c-1fa19630-a6aef04fdc56-4e9f|Terreno en  Aucallama, Huaral||||PE|Aucallama, Huaral|Lima Departamento||-11.5592102|-77.17952009999999
$ 96,000|/inmueble/caf9-bacb-c4fc59f4-66bc9701b234-36ed|Terreno en  Villa Maria Del Triunfo, Lima||||PE|Villa Maria del Triunfo, Lima|Lima Departamento||-12.170365|-76.940415
$ 65,000|/inmueble/8a9e-9bc9-8ace8761-92812e34b097-3a35|Terreno en  Villa El Salvador, Lima||||PE|Villa El Salvador, Lima|Lima Departamento||-12.242393|-76.914937
$ 4,042,800|/inmueble/444790|Terreno en  Santiago De Surco, Lima||||PE|Santiago de Surco, Lima|Lima Departamento||-12.0463731|-77.042754
$ 170,000|/inmueble/591793|Terreno en  Condominio La Quebrada, Quebrada La Cantera, Nueva Toledo, Cieneguilla, Lima, Perú||||PE|Cieneguilla, Lima|Lima Departamento|Condominio La Quebrada, Quebrada La Cantera, Nueva Toledo, Cieneguilla, Lima, Perú|-12.0994818|-76.79442639999999
$ 1,575,000|/inmueble/306839|Terreno en  Santiago De Surco, Lima|850m2|||PE|Santiago de Surco, Lima|Lima Departamento||-12.046374|-77.0427934
$ 8,000,000|/inmueble/357650|Terreno en  Santa Clara, Lima|13,954m2|||PE|Santa Clara, Ate, Lima|Lima Departamento||-12.0147737|-76.88504329999999
$ 270,000|/inmueble/e9aa-9a7f-c9fb1aec-66a76413747a-33a3|Terreno en  Carabayllo, Lima||||PE|Carabayllo, Lima|Lima Departamento||-11.756242|-76.978708
$ 150,000|/inmueble/2ab5-a755-761e2875-d2cedc72e390-3e5e|Terreno en  Chilca, Cañete||||PE|Chilca, Cañete|Lima Departamento||-12.485099|-76.761786
$ 100,000|/inmueble/9807-b761-71c08160-483119de9c37-3db1|Terreno en  Chaclacayo, Lima||||PE|Chaclacayo, Lima|Lima Departamento||-11.972257|-76.787854
$ 63,000|/inmueble/50b2-af57-129ba305-97c5f25a01e9-397e|Terreno en  Chosica, Lima||||PE|Chosica, Lima|Lima Departamento||-11.993183|-76.924512
$ 58,000|/inmueble/9caf-bd6e-cafd373c-a330796772ed-3c55|Terreno en  Villa El Salvador, Lima||||PE|Villa El Salvador, Lima|Lima Departamento||-12.222765|-76.941308
$ 68,000|/inmueble/1c25-b8e0-2b76dfa3-b9ce275b4121-3a8f|Terreno en  Barranco, Lima||||PE|Barranco, Lima|Lima Departamento||-12.165746|-76.963723
$ 66,000|/inmueble/7e99-98c9-7ef5ba6f-63dc8acba555-34d1|Terreno en  Asia, Cañete||||PE|Asia, Cañete|Lima Departamento||-12.765559|-76.532204
$ 1,921,500|/inmueble/287153|Terreno en  Huarochiri, Chosica, Lima, Lima, Peru|19,215m2|||PE|Chosica, Lima|Lima Departamento|Huarochiri, Chosica, Lima, Lima, Peru|-11.9749438|-76.9379621
$ 2,250,000|/inmueble/376622|Terreno en  Sol De La Molina, La Molina, Lima, Lima, Peru|3,000m2|||PE|El Sol De La Molina, La Molina, Lima|Lima Departamento|Sol De La Molina, La Molina, Lima, Lima, Peru|-12.0874226|-76.9088443
$ 3,050,000|/inmueble/c76423|Terreno en  Shangrila Valle Chillon Km24 Panamericana Norte, Puente Piedra, Lima, Lima, Peru||||PE|Puente Piedra, Lima|Lima Departamento|Shangrila Valle Chillon Km24 Panamericana Norte, Puente Piedra, Lima, Lima, Peru|-11.862064|-77.07795
$ 315,000|/inmueble/479748|Terreno en  Calle Tafur 162, Surco, Perú||||PE|Santiago de Surco, Lima|Lima Departamento|Calle Tafur 162, Surco, Perú|-12.1199934|-76.9958297
$ 724,230|/inmueble/9f89-875c-7c207027-8b36f29d7c34-4f38|Terreno en  Huertos De Oro De San Hilarion, Manzana R, Chilca, Perú||||PE|Chilca, Cañete|Lima Departamento|Huertos De Oro De San Hilarion, Manzana R, Chilca, Perú|-12.5242719|-76.7210144
$ 259,000|/inmueble/427503|Terreno en  San Juan De Miraflores, Lima||||PE|San Juan de Miraflores, Lima|Lima Departamento||-12.157333|-76.963668
$ 39,990|/inmueble/583225|Terreno en  Cieneguilla, Perú||||PE|Cieneguilla, Lima|Lima Departamento|Cieneguilla, Perú|-12.0948156|-76.7567368
$ 35,000|/inmueble/427504|Terreno en  Chosica, Lima||||PE|Chosica, Lima|Lima Departamento||-11.974507|-76.807457
$ 300,000|/inmueble/fcd8-9e56-85fe077f-f8ddf5505f7e-35bf|Terreno en  La Planicie, Lima||||PE|La Planicie, La Molina, Lima|Lima Departamento||-12.0820196|-76.928234
$ 460,000|/inmueble/488828|Terreno en  Alameda Del Premio Real, La Encantada De Villa, Chorrillos, Lima, Perú||||PE|Chorrillos, Lima|Lima Departamento|Alameda Del Premio Real, La Encantada De Villa, Chorrillos, Lima, Perú|-12.2087819|-77.006221
$ 86,000|/inmueble/b6a7-911c-2b7bc0d5-b3c9fe3557bc-347f|Terreno en  Villa El Salvador, Lima||||PE|Villa El Salvador, Lima|Lima Departamento||-12.223205|-76.941694
$ 55,500|/inmueble/f5ec-ac48-ec0fbbd7-e2fdd09c891a-44b5|Terreno en  Condominio Brisas Del Mar, Asia, Perú||||PE|Asia, Cañete|Lima Departamento|Condominio Brisas Del Mar, Asia, Perú|-12.8339266|-76.5289526
$ 87,000|/inmueble/567033|Terreno en  Condominio Fundo Pradera, 1s, Asia, Perú||||PE|Asia, Cañete|Lima Departamento|Condominio Fundo Pradera, 1s, Asia, Perú|-12.7188391|-76.6115935
$ 55,800|/inmueble/b81c-9c70-b238f160-2dfe17ea67ca-4120|Terreno en  Condominio Brisas Del Mar, Asia, Perú||||PE|Asia, Cañete|Lima Departamento|Condominio Brisas Del Mar, Asia, Perú|-12.8339266|-76.5289526
$ 56,400|/inmueble/ee6b-8f63-5cd07466-a20a1d4541c3-4ad5|Terreno en  Condominio Brisas Del Mar, Asia, Perú||||PE|Asia, Cañete|Lima Departamento|Condominio Brisas Del Mar, Asia, Perú|-12.8339266|-76.5289526
$ 87,000|/inmueble/479744|Terreno en  Condominio Fundo Pradera, 1s, Asia, Perú||||PE|Asia, Cañete|Lima Departamento|Condominio Fundo Pradera, 1s, Asia, Perú|-12.7188391|-76.6115935
$ 5,100,000|/inmueble/567017|Terreno en  Santa María Del Mar, Perú||||PE|Santa Maria del Mar, Lima|Lima Departamento|Santa María Del Mar, Perú|-12.4058611|-76.7743383
$ 56,700|/inmueble/ddae-a4c5-1bc61a74-7d6e8c9cb7b2-4e5c|Terreno en  Condominio Brisas Del Mar, Asia, Perú||||PE|Asia, Cañete|Lima Departamento|Condominio Brisas Del Mar, Asia, Perú|-12.8339266|-76.5289526
$ 850,000|/inmueble/596731|Terreno en  Corpac, Lima||||PE|Corpac, San Isidro, Lima|Lima Departamento||-12.0936711|-77.029992
$ 57,000|/inmueble/82fd-836f-c44db3ef-62f95b58c43-44a9|Terreno en  Condominio Brisas Del Mar, Asia, Perú||||PE|Asia, Cañete|Lima Departamento|Condominio Brisas Del Mar, Asia, Perú|-12.8339266|-76.5289526
$ 4,000,000|/inmueble/567120|Terreno en  Carretera Panamericana Sur 57, Chilca, Perú||||PE|Pucusana, Lima|Lima Departamento|Carretera Panamericana Sur 57, Chilca, Perú|-12.4556903|-76.75417829999999
$ 8,500,000|/inmueble/567023|Terreno en  Santa María Del Mar, Perú||||PE|Santa Maria del Mar, Lima|Lima Departamento|Santa María Del Mar, Perú|-12.4058611|-76.7743383
$ 43,000|/inmueble/427910|Terreno en  Carabayllo, Lima||||PE|Carabayllo, Lima|Lima Departamento||-11.87159|-77.046018
$ 28,500|/inmueble/596027|Terreno en  Condominio Puerta Del Sol Asia, Asia, Perú||||PE|Asia, Cañete|Lima Departamento|Condominio Puerta Del Sol Asia, Asia, Perú|-12.7874014|-76.5237537
$ 500,000|/inmueble/591270|Terreno en  Pampa Calicanto, Cañete, Perú||||PE|Asia, Cañete|Lima Departamento|Pampa Calicanto, Cañete, Perú|-12.7241667|-76.615
$ 920,970|/inmueble/465624|Terreno en  Capilla De Asia, Asia, Perú||||PE|Asia, Cañete|Lima Departamento|Capilla De Asia, Asia, Perú|-12.7787364|-76.5560481
$ 55,000|/inmueble/591779|Terreno en  Condominio Alto Bujama, Carretera Panamericana Sur, Asia, Perú||||PE|Mala, Cañete|Lima Departamento|Condominio Alto Bujama, Carretera Panamericana Sur, Asia, Perú|-12.7215268|-76.62761569999999
$ 399,000|/inmueble/fd0b-90e2-4d5fc2c0-da298a4b1f93-4f41|Terreno en  Plaza Centro América, Miraflores, Perú||||PE|Santa Cruz, Miraflores, Lima|Lima Departamento|Plaza Centro América, Miraflores, Perú|-12.1190483|-77.0428637
$ 1,000,000|/inmueble/c973-92a6-47b406a9-9ee312695160-435b|Terreno en  Avenida Alameda De La Molina Vieja, La Molina Vieja, Lima, Perú||||PE|Camacho, La Molina, Lima|Lima Departamento|Avenida Alameda De La Molina Vieja, La Molina Vieja, Lima, Perú|-12.0875323|-76.9523011
$ 1,050,000|/inmueble/593409|Terreno en  Calle Los Robles, San Isidro, Perú||||PE|Orrantia, San Isidro, Lima|Lima Departamento|Calle Los Robles, San Isidro, Perú|-12.094649|-77.0426945
$ 97,000|/inmueble/458289|Terreno en  Jose Maria Corbacho, Avenida Los Próceres, Santiago De Surco, Perú||||PE|Santiago de Surco, Lima|Lima Departamento|Jose Maria Corbacho, Avenida Los Próceres, Santiago De Surco, Perú|-12.1507488|-76.9879679
$ 365,000|/inmueble/603169|Terreno en  Comisaría De Cieneguilla, Nueva Toledo, Cieneguilla, Perú||||PE|Cieneguilla, Lima|Lima Departamento|Comisaría De Cieneguilla, Nueva Toledo, Cieneguilla, Perú|-12.1157533|-76.8129057
$ 150,000|/inmueble/431788|Terreno en  Chilca, Cañete||||PE|Chilca, Cañete|Lima Departamento||-12.47787|-76.757458
$ 87,000|/inmueble/734a-95f1-2875174a-fdd54ba2246b-4180|Terreno en  6fcj+3r Asia, Perú||||PE|Asia, Cañete|Lima Departamento|6fcj+3r Asia, Perú|-12.779794816604584|-76.51794278901367
$ 3,933,000|/inmueble/89d2-adbe-2e9680-975aa4bfb703-41ad|Terreno en  Villa El Salvador, Perú||||PE|Villa El Salvador, Lima|Lima Departamento|Villa El Salvador, Perú|-12.2162218|-76.9415442
$ 348,500|/inmueble/306613|Terreno en  28 De Julio, Lima|232m2|||PE|28 De Julio, Breña, Lima|Lima Departamento||-12.057053|-77.0516834
$ 32,000|/inmueble/472602|Terreno en  Cerro Azul, Perú||||PE|Cerro Azul, Cañete|Lima Departamento|Cerro Azul, Perú|-13.0017334|-76.4487393
$ 265,000|/inmueble/501338|Terreno en  Jirón Los Chasquis 737, San Juan De Lurigancho, Perú||||PE|San Juan de Lurigancho, Lima|Lima Departamento|Jirón Los Chasquis 737, San Juan De Lurigancho, Perú|-12.0249443|-77.00370649999999
$ 32,000|/inmueble/455215|Terreno en  San Antonio De Pachacamac - Menorca, Manchay Alto, Pachacamac, Perú||||PE|Pachacamac, Lima|Lima Departamento|San Antonio De Pachacamac - Menorca, Manchay Alto, Pachacamac, Perú|-12.1581067|-76.8541127
$ 11,250,000|/inmueble/bd18-8f8e-fcc99548-8f2246d87ba5-473c|Terreno en  Avenida Santa Maria, Santa María Del Mar, Perú||||PE|San Bartolo, Lima|Lima Departamento|Avenida Santa Maria, Santa María Del Mar, Perú|-12.399378|-76.7759331
$ 63,727.97|/inmueble/e9ec-bf5c-d2ff9db1-ccd243e9e4de-4f24|Terreno en  Condominio Playa Muelle Azul, Cerro Azul, Cañete, Perú||||PE|Cerro Azul, Cañete|Lima Departamento|Condominio Playa Muelle Azul, Cerro Azul, Cañete, Perú|-13.0149212|-76.48077390000002
$ 31,424.05|/inmueble/4db9-8abc-b8c2c32f-25decd9a8756-4c9e|Terreno en  Condominio Playa Muelle Azul, Cerro Azul, Perú||||PE|Cerro Azul, Cañete|Lima Departamento|Condominio Playa Muelle Azul, Cerro Azul, Perú|-13.0149212|-76.48077390000002
$ 57,900|/inmueble/607185|Terreno en  5f79+6q, Asia 15690, Perú||||PE|Asia, Cañete|Lima Departamento|5f79+6q, Asia 15690, Perú|-12.836648299604299|-76.52935166931152
$ 875,097|/inmueble/f2b7-a6b1-85ea33c8-c078c157489a-470d|Terreno en  1s 762, Asia 15690, Perú||||PE|Asia, Cañete|Lima Departamento|1s 762, Asia 15690, Perú|-12.77154721251308|-76.58558593374634
$ 33,000,000|/inmueble/429721|Terreno en  Cercado De Lima, Lima||||PE|Cercado de Lima, Lima|Lima Departamento||-11.9948375|-76.9415156
$ 57,600|/inmueble/a69c-a217-575f308a-9d8d0b7fc812-4f0c|Terreno en  Condominio Brisas Del Mar, Asia, Perú||||PE|Asia, Cañete|Lima Departamento|Condominio Brisas Del Mar, Asia, Perú|-12.8339266|-76.5289526
$ 55,200|/inmueble/daf1-b883-3b256b04-6ca67d2a00aa-4b24|Terreno en  Condominio Brisas Del Mar, Asia, Perú||||PE|Asia, Cañete|Lima Departamento|Condominio Brisas Del Mar, Asia, Perú|-12.8339266|-76.5289526
$ 8,500,000|/inmueble/fead-964e-2d4f6a9e-124b172a90d5-448e|Terreno en  Avenida Santa Maria, Santa María Del Mar, Perú||||PE|San Bartolo, Lima|Lima Departamento|Avenida Santa Maria, Santa María Del Mar, Perú|-12.399378|-76.7759331
