precio|enlace|descripcion|area|habitaciones|banios|pais|localidad|region|direccion|latitude|longitude
$ 50|/inmueble/489934|Terreno en  Chacra Y Mar, Perú||||PE|Aucallama, Huaral|Lima Departamento|Chacra Y Mar, Perú|-11.613070348089998|-77.23333049565554
$ 110,000|/inmueble/478030|Terreno en  Condominio Islas De San Pedro, Lurín, Perú||||PE|Lurin, Lima|Lima Departamento|Condominio Islas De San Pedro, Lurín, Perú|-12.2874227|-76.8741601
$ 2,400,000|/inmueble/8be3-ad0f-380c56aa-40a12b44e10a-4c6c|Terreno en  Q4rw+g7 Pachacamac, Perú||||PE|Pachacamac, Lima|Lima Departamento|Q4rw+g7 Pachacamac, Perú|-12.20873675083182|-76.85434686878662
$ 75,000|/inmueble/ca20-9e08-22b1f7c1-916c8a8aa5db-4773|Terreno en  C859+jm8, San Antonio 15600, Perú||||PE|San Antonio, Cañete|Lima Departamento|C859+jm8, San Antonio 15600, Perú|-12.591424368129397|-76.68153532587279
$ 104,600|/inmueble/559973|Terreno en  Santa Cruz De Flores, Cañete||||PE|Santa Cruz De Flores, Cañete|Lima Departamento||-12.5921229|-76.6221371
$ 2,765,000,000|/inmueble/462610|Terreno en  Torreblanca, Carabayllo, Perú||||PE|Carabayllo, Lima|Lima Departamento|Torreblanca, Carabayllo, Perú|-11.8535033|-77.0003067
$ 2,550,000|/inmueble/616348|Terreno en  Av. Monterrico Chico, Lima, Perú||||PE|Santiago de Surco, Lima|Lima Departamento|Av. Monterrico Chico, Lima, Perú|-12.121427662198458|-76.98121190071106
$ 190,000|/inmueble/462039|Terreno en  Hacienda San Andres, Carretera Panamericana Sur, Santa Cruz De Flores, Perú||||PE|San Vicente De Cañete, Cañete|Lima Departamento|Hacienda San Andres, Carretera Panamericana Sur, Santa Cruz De Flores, Perú|-12.5835309|-76.6709316
$ 315,000|/inmueble/448641|Terreno en  Av. Defensores Del Morro 2087, Chorrillos 15064, Perú|230m2|||PE|Chorrillos, Lima|Lima Departamento|Av. Defensores Del Morro 2087, Chorrillos 15064, Perú|-12.180054|-77.013384
$ 1,100,000|/inmueble/554746|Terreno en  Huertos De Villena, Los Fresnos, Pachacamac, Perú||||PE|Lurin, Lima|Lima Departamento|Huertos De Villena, Los Fresnos, Pachacamac, Perú|-12.2488765|-76.8899459
$ 900,000|/inmueble/93d6-8a6a-389eb47c-2498d63ce591-4e0c|Terreno en  Av. Los Eucaliptos, Lurín, Perú||||PE|Lurin, Lima|Lima Departamento|Av. Los Eucaliptos, Lurín, Perú|-12.2358011|-76.8978736
$ 150,000|/inmueble/320959|Terreno en  Pasaje La Florida, Chosica, Lima, Lima, Peru||||PE|Independencia, Lima|Lima Departamento|Pasaje La Florida, Chosica, Lima, Lima, Peru|-12.0096786|-77.0522834
$ 500,000|/inmueble/543286|Terreno en  Chilca, Perú||||PE|Chilca, Cañete|Lima Departamento|Chilca, Perú|-12.5146159|-76.7349974
$ 270,000|/inmueble/490125|Terreno en  Los Erizos 26, Lima 15846, Perú||||PE|Lurin, Lima|Lima Departamento|Los Erizos 26, Lima 15846, Perú|-12.3091209975785|-76.8424137753937
$ 260,000|/inmueble/417396|Terreno en  Comisaría De Cieneguilla, Nueva Toledo, Cieneguilla, Perú||||PE|Cieneguilla, Lima|Lima Departamento|Comisaría De Cieneguilla, Nueva Toledo, Cieneguilla, Perú|-12.1157533|-76.8129057
$ 40,000|/inmueble/429050|Terreno en  Carabayllo, Perú||||PE|Carabayllo, Lima|Lima Departamento|Carabayllo, Perú|-11.792902|-76.9873477
$ 55,000|/inmueble/a1f4-b8f9-c1562a3e-23e2d7bc74f7-4447|Terreno en  Urb. Santa Maria De Carabayllo, Carabayllo, Perú||||PE|Carabayllo, Lima|Lima Departamento|Urb. Santa Maria De Carabayllo, Carabayllo, Perú|-11.8384284|-77.0507344
$ 55,000|/inmueble/465582|Terreno en  Prolongación Los Cedros, Chaclacayo, Perú||||PE|Chaclacayo, Lima|Lima Departamento|Prolongación Los Cedros, Chaclacayo, Perú|-11.9809454|-76.7797847
$ 18,854.43|/inmueble/356386|Terreno en  Chosica, Lima|115m2|||PE|Chosica, Lima|Lima Departamento||-11.974873|-76.895383
$ 55,000|/inmueble/545496|Terreno en  Urb. Mirasol De Huampaní I Etapa, Lurigancho-chosica, Perú||||PE|Chosica, Lima|Lima Departamento|Urb. Mirasol De Huampaní I Etapa, Lurigancho-chosica, Perú|-11.970607|-76.8079182
$ 163,405.06|/inmueble/444778|Terreno en  San Juan De Miraflores, Lima||||PE|San Juan de Miraflores, Lima|Lima Departamento||-12.1545657|-76.96852319999999
$ 230,000|/inmueble/593999|Terreno en  C, Urbanización Alameda De La Rivera, Ate, Perú||||PE|Salamanca De Monterrico, Ate, Lima|Lima Departamento|C, Urbanización Alameda De La Rivera, Ate, Perú|-12.0248544|-76.9438709
$ 460,000|/inmueble/10bd-b398-35debeff-d6236f950a3d-439b|Terreno en  Urbanización Santa Maria,chosica, Carretera Central, Lurigancho-chosica, Perú||||PE|Cercado de Lima, Lima|Lima Departamento|Urbanización Santa Maria,chosica, Carretera Central, Lurigancho-chosica, Perú|-11.9491148|-76.7204945
$ 1,100,000|/inmueble/618948|Terreno en  San Antonio, Lima||||PE|San Antonio, Miraflores, Lima|Lima Departamento||-12.1288463|-77.0128369
$ 1,350,000|/inmueble/35e6-a09e-8c941206-b518c2be44e5-1273|Terreno en  Santiago De Surco, Lima||||PE|Santiago de Surco, Lima|Lima Departamento||-12.1311281|-77.0019587
$ 50|/inmueble/541685|Terreno en  Huaral, Perú||||PE|Huaral Distrito, Huaral|Lima Departamento|Huaral, Perú|-11.4965172|-77.21177329999999
$ 100,000|/inmueble/321973|Terreno en  3jvp+xg Quilmaná, Perú|300m2|||PE|Quilmana, Cañete|Lima Departamento|3jvp+xg Quilmaná, Perú|-12.90508201805646|-76.36372111737728
$ 40,000|/inmueble/465301|Terreno en  Carabayllo, Lima||||PE|Carabayllo, Lima|Lima Departamento||-11.8416533|-77.0449785
$ 65,000|/inmueble/583729|Terreno en  Lunahuana, Cañete||||PE|Lunahuana, Cañete|Lima Departamento||-13.027715|-76.1319953
$ 30,000|/inmueble/502748|Terreno en  Local Comunal Juan Velasco, Lurigancho-chosica, Huarochirí, Perú||||PE|Ricardo Palma, Huarochiri|Lima Departamento|Local Comunal Juan Velasco, Lurigancho-chosica, Huarochirí, Perú|-11.9259929|-76.6637729
$ 740,000|/inmueble/404813|Terreno en  Calle Las Flores 251, Miraflores 15074, Perú||||PE|Santa Cruz, Miraflores, Lima|Lima Departamento|Calle Las Flores 251, Miraflores 15074, Perú|-12.114414|-77.028094
$ 65,000|/inmueble/465288|Terreno en  San Juan De Miraflores, Lima||||PE|San Juan de Miraflores, Lima|Lima Departamento||-12.1750244|-76.9638309
$ 25,000|/inmueble/583721|Terreno en  Lunahuana, Cañete||||PE|Lunahuana, Cañete|Lima Departamento||-13.027715|-76.1319953
$ 1,105,200|/inmueble/520715|Terreno en  Corpac, Lima||||PE|Corpac, San Isidro, Lima|Lima Departamento||-12.0948899|-77.0130629
$ 42,000|/inmueble/450023|Terreno en  Cercado De Lima, Lima|115m2|||PE|Cercado de Lima, Lima|Lima Departamento||-11.8816987|-77.0362967
$ 120,000|/inmueble/423172|Terreno en  Av. Mariscal Ramón Castilla 10, Surco, Perú||||PE|Santiago de Surco, Lima|Lima Departamento|Av. Mariscal Ramón Castilla 10, Surco, Perú|-12.135042190551758|-77.00841522216797
$ 2,651,675|/inmueble/430169|Terreno en  Pedro Venturo 451, Miraflores, Perú||||PE|San Antonio, Miraflores, Lima|Lima Departamento|Pedro Venturo 451, Miraflores, Perú|-12.1224641|-77.01461069999999
$ 870,000|/inmueble/449976|Terreno en  Cercado De Miraflores, Lima|300,000m2|||PE|Cercado de Miraflores, Miraflores, Lima|Lima Departamento||-12.1217027|-77.0307754
$ 55,000|/inmueble/617255|Terreno en  Zapallal, Puente Piedra, Perú||||PE|Puente Piedra, Lima|Lima Departamento|Zapallal, Puente Piedra, Perú|-11.8436103|-77.0987287
$ 50,000|/inmueble/440320|Terreno en  Santa Rosa, Lima||||PE|Santa Rosa, Lima|Lima Departamento||-11.8016612|-77.17219589999999
$ 1,600,000|/inmueble/499220|Terreno en  Puente Piedra, Lima||||PE|Puente Piedra, Lima|Lima Departamento||-11.8648256|-77.07442979999999
$ 3,000,000|/inmueble/63a8-8d14-c8f1d6a7-abbabcadd0ba-48aa|Terreno en  Iquitos, Lima, Perú||||PE|Aurora, Miraflores, Lima|Lima Departamento|Iquitos, Lima, Perú|-12.0288384|-77.0171658
$ 45,000|/inmueble/468660|Terreno en  Las Gaviotas, Asia, Perú||||PE|San Vicente De Cañete, Cañete|Lima Departamento|Las Gaviotas, Asia, Perú|-12.7392964|-76.6323799
$ 230,000|/inmueble/604979|Terreno en  X3g4+9h7, Ate 15498, Perú|216m2|||PE|Salamanca De Monterrico, Ate, Lima|Lima Departamento|X3g4+9h7, Ate 15498, Perú|-12.024452|-76.943528
$ 2,750,000|/inmueble/437696|Terreno en  Pachacamac, Perú||||PE|Pachacamac, Lima|Lima Departamento|Pachacamac, Perú|-12.2095337|-76.8538748
$ 99,000|/inmueble/2977-b345-8f18bfa0-19b50c84d51b-4986|Terreno en  Oficina De La Asociación De Propietarios De La Urb. Country Club Balneario Santa Rosa, Avenue Bertello, Santa Rosa, Perú||||PE|Santa Rosa, Lima|Lima Departamento|Oficina De La Asociación De Propietarios De La Urb. Country Club Balneario Santa Rosa, Avenue Bertello, Santa Rosa, Perú|-11.7967863|-77.1729209
$ 620,000|/inmueble/583226|Terreno en  Golondrinas 210, San Isidro, Perú||||PE|Corpac, San Isidro, Lima|Lima Departamento|Golondrinas 210, San Isidro, Perú|-12.1000802|-77.02133959999999
$ 1,178,000|/inmueble/459108|Terreno en  Malecon Santa Maria, Santa María Del Mar, Perú||||PE|Cercado de Lima, Lima|Lima Departamento|Malecon Santa Maria, Santa María Del Mar, Perú|-12.4111652|-76.7802578
$ 90,000|/inmueble/463271|Terreno en  Av. San Martín 3925, 15500, Perú||||PE|Santa Eulalia, Huarochiri|Lima Departamento|Av. San Martín 3925, 15500, Perú|-11.894506631573357|-76.65740077931517
$ 195,000|/inmueble/538156|Terreno en  Chaclacayo, Perú||||PE|Chaclacayo, Lima|Lima Departamento|Chaclacayo, Perú|-11.9947642|-76.76827750000001
$ 265|/inmueble/a624-a727-6932f744-ffa1787a6a74-4b61|Terreno en  Condominio Pachacamac, Pachacamac, Perú||||PE|Pachacamac, Lima|Lima Departamento|Condominio Pachacamac, Pachacamac, Perú|-12.2095337|-76.8538748
$ 675,000|/inmueble/520716|Terreno en  Corpac, Lima||||PE|Corpac, San Isidro, Lima|Lima Departamento||-12.1055278|-77.0117657
$ 50,000|/inmueble/449610|Terreno en  Punta Negra, Lima||||PE|Punta Negra, Lima|Lima Departamento||-12.364875|-76.794547
$ 140,000|/inmueble/512147|Terreno en  Huertos De Manchay, Huertos De Manchay, Avenida Victor Malasquez, Pachacamac, Perú||||PE|La Victoria, Lima|Lima Departamento|Huertos De Manchay, Huertos De Manchay, Avenida Victor Malasquez, Pachacamac, Perú|-12.1243411|-76.8724101
$ 30,000|/inmueble/513753|Terreno en  Carabayllo, Lima||||PE|Carabayllo, Lima|Lima Departamento||-11.871595348427814|-77.04212683017424
$ 1,350,000|/inmueble/50e7-bdb0-3fb7b86c-1a6546dba06b-484c|Terreno en  Santiago De Surco, Lima||||PE|Santiago de Surco, Lima|Lima Departamento||-12.149283|-77.01074489999999
$ 215,000|/inmueble/451747|Terreno en  Los Rosales 715, Cercado De Lima 15009, Perú|160m2|||PE|Santa Anita, Lima|Lima Departamento|Los Rosales 715, Cercado De Lima 15009, Perú|-12.04186|-76.962827
$ 6,720,000|/inmueble/620949|Terreno en  Avenida Jorge Chávez, Hualmay, Perú||||PE|Hualmay, Huaura|Lima Departamento|Avenida Jorge Chávez, Hualmay, Perú|-11.086196|-77.5985767
$ 56,880|/inmueble/426899|Terreno en  Azpitia, Santa Cruz De Flores, Perú||||PE|Santa Cruz De Flores, Cañete|Lima Departamento|Azpitia, Santa Cruz De Flores, Perú|-12.5921229|-76.6221371
$ 650,000|/inmueble/e5f0-90ae-39f98683-14185b3eef02-4b67|Terreno en  Jirón Cerro Azul, Santiago De Surco, Perú||||PE|San Juan de Miraflores, Lima|Lima Departamento|Jirón Cerro Azul, Santiago De Surco, Perú|-12.1355329|-76.9765109
$ 189,000|/inmueble/524045|Terreno en  Urb Real De Santa Clara, Avenida Daniel Alcides Carrión, Ate, Perú||||PE|Santa Clara, Ate, Lima|Lima Departamento|Urb Real De Santa Clara, Avenida Daniel Alcides Carrión, Ate, Perú|-12.0202097|-76.8768523
$ 3,205,880|/inmueble/554332|Terreno en  Condominio San Javier, Avenue Libertad, Mala, Cañete Province, Perú||||PE|Mala, Cañete|Lima Departamento|Condominio San Javier, Avenue Libertad, Mala, Cañete Province, Perú|-12.6674815|-76.6472165
$ 980,000|/inmueble/460698|Terreno en  Chorrillos, Lima||||PE|Chorrillos, Lima|Lima Departamento||-12.1787931|-77.0189868
$ 462,487|/inmueble/464620|Terreno en  Casuarinas Sur, Santiago De Surco, Perú||||PE|Santiago de Surco, Lima|Lima Departamento|Casuarinas Sur, Santiago De Surco, Perú|-12.128004|-76.96790659999999
$ 860,000|/inmueble/398752|Terreno en  Puente Piedra, Perú||||PE|Puente Piedra, Lima|Lima Departamento|Puente Piedra, Perú|-11.8648256|-77.07442979999999
$ 55,000|/inmueble/502732|Terreno en  Prol. Los Cedros 347, Chaclacayo 15472, Perú||||PE|Chaclacayo, Lima|Lima Departamento|Prol. Los Cedros 347, Chaclacayo 15472, Perú|-11.980904076327171|-76.77942731435547
$ 69,000|/inmueble/500116|Terreno en  X4wg+wgr, Lurigancho-chosica 15464, Perú|120m2|||PE|Chosica, Lima|Lima Departamento|X4wg+wgr, Lurigancho-chosica 15464, Perú|-12.002149|-76.873606
$ 4,320,000|/inmueble/609299|Terreno en  Via Láctea, Surco, Perú||||PE|Santiago de Surco, Lima|Lima Departamento|Via Láctea, Surco, Perú|-12.0874801|-76.9720214
$ 273,500|/inmueble/453871|Terreno en  Pando, Lima||||PE|Pando, San Miguel, Lima|Lima Departamento||-12.0813834|-77.07856129999999
$ 800,000|/inmueble/465517|Terreno en  Ricardo Palma, Urb Santa Ana, Lurigancho-chosica, Perú||||PE|Ricardo Palma, Huarochiri|Lima Departamento|Ricardo Palma, Urb Santa Ana, Lurigancho-chosica, Perú|-11.9247065|-76.6607634
(Precio a consultar)|/inmueble/549315|Terreno en  San Antonio, Cañete||||PE|San Antonio, Cañete|Lima Departamento||-12.6172978|-76.6690802
$ 459,000|/inmueble/466726|Terreno en  Mala, Cañete||||PE|Mala, Cañete|Lima Departamento||-12.592123|-76.622137
$ 1,757,400|/inmueble/582830|Terreno en  San Juan De Lurigancho, Lima||||PE|San Juan de Lurigancho, Lima|Lima Departamento||-12.020621305593894|-76.94133320694581
$ 76,000|/inmueble/466716|Terreno en  Carabayllo, Lima||||PE|Carabayllo, Lima|Lima Departamento||-11.792902|-76.987348
(Precio a consultar)|/inmueble/550821|Terreno en  Santa Clara, Lima||||PE|Santa Clara, Ate, Lima|Lima Departamento||-12.0181594|-76.8951155
(Precio a consultar)|/inmueble/552529|Terreno en  Corpac, Lima||||PE|Corpac, San Isidro, Lima|Lima Departamento||-12.0922797|-77.031344
$ 1,499,999|/inmueble/429116|Terreno en  Santa Cruz, Lima||||PE|Santa Cruz, Miraflores, Lima|Lima Departamento||-12.1152552|-77.0484237
$ 49,000|/inmueble/370322|Terreno en  79fg+6m Asia, Perú|140m2|||PE|Mala, Cañete|Lima Departamento|79fg+6m Asia, Perú|-12.7269375|-76.6233125
(Precio a consultar)|/inmueble/549309|Terreno en  San Antonio, Cañete||||PE|San Antonio, Cañete|Lima Departamento||-12.6195865|-76.6699729
(Precio a consultar)|/inmueble/552324|Terreno en  Aurora, Lima||||PE|Aurora, Miraflores, Lima|Lima Departamento||-12.0676698|-77.0322386
$ 62,000|/inmueble/363659|Terreno en  5fxf+hpf, Asia 15690, Perú|418m2|||PE|Asia, Cañete|Lima Departamento|5fxf+hpf, Asia 15690, Perú|-12.801062|-76.525701
$ 89,000|/inmueble/449682|Terreno en  Cercado De Lima, Lima|160m2|||PE|Cercado de Lima, Lima|Lima Departamento||-11.9456223|-77.067217
$ 60,000|/inmueble/363660|Terreno en  5fxf+hpf, Asia 15690, Perú|383m2|||PE|Asia, Cañete|Lima Departamento|5fxf+hpf, Asia 15690, Perú|-12.801062|-76.525701
$ 30,000|/inmueble/466656|Terreno en  Carabayllo, Lima||||PE|Carabayllo, Lima|Lima Departamento||-11.868879|-77.044471
$ 29,000|/inmueble/449893|Terreno en  Cercado De Lima, Lima|120m2|||PE|Cercado de Lima, Lima|Lima Departamento||-11.8816987|-77.0362967
$ 60,000|/inmueble/466648|Terreno en  Carabayllo, Lima||||PE|Carabayllo, Lima|Lima Departamento||-11.868879|-77.044471
(Precio a consultar)|/inmueble/547507|Terreno en  Chaclacayo, Lima||||PE|Chaclacayo, Lima|Lima Departamento||-11.9640384|-76.7414271
$ 2,618,100|/inmueble/507785|Terreno en  San Juan De Lurigancho, San Juan De Lurigancho, Perú||||PE|San Juan de Lurigancho, Lima|Lima Departamento|San Juan De Lurigancho, San Juan De Lurigancho, Perú|-11.9689301|-76.99398359999999
$ 380,000|/inmueble/601244|Terreno en  San Juan De Miraflores, Lima||||PE|San Juan de Miraflores, Lima|Lima Departamento||-12.1538004|-76.9667957
$ 25,000|/inmueble/592073|Terreno en  Los Andenes De San Antonio, San Antonio, Perú||||PE|San Vicente De Cañete, Cañete|Lima Departamento|Los Andenes De San Antonio, San Antonio, Perú|-12.6025742|-76.6831397
$ 78,000|/inmueble/8fb2-af85-9c537d89-b6e231ec292d-3207|Terreno en  Quilmana, Cañete||||PE|Quilmana, Cañete|Lima Departamento||-12.94068|-76.398454
$ 3,500,000|/inmueble/400380|Terreno en  Av Prolongacion Tupac Amaru, Carabayllo, Lima, Lima, Peru||||PE|Carabayllo, Lima|Lima Departamento|Av Prolongacion Tupac Amaru, Carabayllo, Lima, Lima, Peru|-11.792919|-76.987341
$ 17,920|/inmueble/359753|Terreno en  Av. Pedro Sayan 132, Barranca 15169, Perú|112m2|||PE|Barranca Distrito, Barranca|Lima Departamento|Av. Pedro Sayan 132, Barranca 15169, Perú|-10.750762|-77.759511
$ 250,000|/inmueble/332715|Terreno en  Pachacamac, Cercado De Lima 15461, Perú|2,564m2|||PE|Santiago de Surco, Lima|Lima Departamento|Pachacamac, Cercado De Lima 15461, Perú|-12.046374|-77.0427934
$ 38,000|/inmueble/626158|Terreno en  Asia Golf Club, Asia, Perú||||PE|Asia, Cañete|Lima Departamento|Asia Golf Club, Asia, Perú|-12.7479698|-76.6138327
$ 1,345,000|/inmueble/480655|Terreno en  Calle Cabo Blanco 285, San Isidro, Perú||||PE|Orrantia, San Isidro, Lima|Lima Departamento|Calle Cabo Blanco 285, San Isidro, Perú|-12.1051802|-77.057311
$ 750,000|/inmueble/588146|Terreno en  Rinconada Baja, Lima||||PE|Rinconada Baja, La Molina, Lima|Lima Departamento||-12.0896653|-76.93521109999999
$ 500,000|/inmueble/614030|Terreno en  Jirón Castilla, Lurín, Perú||||PE|Lurin, Lima|Lima Departamento|Jirón Castilla, Lurín, Perú|-12.2800695|-76.8624655
$ 45,000|/inmueble/477425|Terreno en  Mirasol De Huampani, Chaclacayo, Perú||||PE|Chosica, Lima|Lima Departamento|Mirasol De Huampani, Chaclacayo, Perú|-11.9736053|-76.8083788
$ 3,300,000|/inmueble/465820|Terreno en  Alameda Del Premio Real, Chorrillos, Perú||||PE|Chorrillos, Lima|Lima Departamento|Alameda Del Premio Real, Chorrillos, Perú|-12.2087819|-77.006221
$ 38,000|/inmueble/584124|Terreno en  Colinas De La Gloria, Carr. Central, Ate, Perú||||PE|Santa Clara, Ate, Lima|Lima Departamento|Colinas De La Gloria, Carr. Central, Ate, Perú|-12.0151927|-76.8516209
$ 1,780,000|/inmueble/4ef0-9bd3-79a946b6-5f02281d0698-1273|Terreno en  Barranco, Lima||||PE|Barranco, Lima|Lima Departamento||-12.13976782910112|-77.02637426555157
$ 170,000|/inmueble/998-8191-73af2a60-4cd4710b8ed4-441d|Terreno en  Av. Prol. Javier Prado Este, Ate, Perú||||PE|Cercado de Lima, Lima|Lima Departamento|Av. Prol. Javier Prado Este, Ate, Perú|-12.0432121|-76.929349
$ 80,000|/inmueble/cf8a-a64c-175dd3f9-d321f03de262-4a05|Terreno en  Condominio Praderas Del Sur, Perú||||PE|Mala, Cañete|Lima Departamento|Condominio Praderas Del Sur, Perú|-12.684355|-76.647769
$ 95,000|/inmueble/608391|Terreno en  Pachacamac, Lima||||PE|Pachacamac, Lima|Lima Departamento||-12.200851019282226|-76.85082781055908
$ 399,000|/inmueble/360374|Terreno en  Playa La Jolla Kilometro 99.5, Asia, Cañete, Lima, Peru|300m2|||PE|Asia, Cañete|Lima Departamento|Playa La Jolla Kilometro 99.5, Asia, Cañete, Lima, Peru|-12.801062|-76.525701
$ 950,000|/inmueble/539459|Terreno en  Santiago De Surco, Lima||||PE|Santiago de Surco, Lima|Lima Departamento||-12.1152255|-76.9719232
$ 15,785,100|/inmueble/428814|Terreno en  Av. Lima 908, Lurín 15841, Perú|105,234m2|||PE|Lurin, Lima|Lima Departamento|Av. Lima 908, Lurín 15841, Perú|-12.2333313|-76.9111294
$ 40,000|/inmueble/477329|Terreno en  Mirasol De Huampani, Chaclacayo, Lima, Perú||||PE|Chosica, Lima|Lima Departamento|Mirasol De Huampani, Chaclacayo, Lima, Perú|-11.9736053|-76.8083788
$ 95,000|/inmueble/b502-b266-437edbf-7848cf233ff-4785|Terreno en  Ricardo Palma, Huarochirí, Perú||||PE|Ricardo Palma, Huarochiri|Lima Departamento|Ricardo Palma, Huarochirí, Perú|-11.9239743|-76.66004149999999
$ 36,000|/inmueble/365997|Terreno en  Av Sta Maria 23, Lima 15122, Perú|105m2|||PE|Carabayllo, Lima|Lima Departamento|Av Sta Maria 23, Lima 15122, Perú|-11.838463|-77.044852
$ 465,000|/inmueble/505578|Terreno en  Casa De Campo Chaclacayo, Los Laureles, Chaclacayo, Perú||||PE|Chaclacayo, Lima|Lima Departamento|Casa De Campo Chaclacayo, Los Laureles, Chaclacayo, Perú|-11.9772446|-76.74840209999999
$ 124,790|/inmueble/434877|Terreno en  Miguel Grau 2815, Lima 15491, Perú||||PE|Santa Clara, Ate, Lima|Lima Departamento|Miguel Grau 2815, Lima 15491, Perú|-12.0239225|-76.8960546
$ 6,189,345|/inmueble/532120|Terreno en  Puente Piedra, Lima||||PE|Puente Piedra, Lima|Lima Departamento||-11.873677290582826|-77.06719207567139
$ 139,800|/inmueble/434876|Terreno en  Miguel Grau 2815, Lima 15491, Perú||||PE|Santa Clara, Ate, Lima|Lima Departamento|Miguel Grau 2815, Lima 15491, Perú|-12.0239225|-76.8960546
$ 42,000|/inmueble/37e1-8347-df4aa535-da08f8d69d1c-4609|Terreno en  Las Casuarinas, Carabayllo, Perú||||PE|Carabayllo, Lima|Lima Departamento|Las Casuarinas, Carabayllo, Perú|-11.9067709|-77.0278608
$ 2,600,000|/inmueble/423210|Terreno en  Lurin, Lima||||PE|Lurin, Lima|Lima Departamento||-12.2608092|-76.8840477
$ 55,000|/inmueble/531624|Terreno en  Canto Grande, San Juan De Lurigancho, Perú||||PE|San Juan de Lurigancho, Lima|Lima Departamento|Canto Grande, San Juan De Lurigancho, Perú|-11.9918483|-77.0149221
$ 3,735,000|/inmueble/362702|Terreno en  Brigida Silva, San Miguel, Lima, Lima, Peru||||PE|Pando, San Miguel, Lima|Lima Departamento|Brigida Silva, San Miguel, Lima, Lima, Peru|-12.081762|-77.0889078
$ 220,000|/inmueble/592594|Terreno en  Jirón Lurín, La Molina, Perú||||PE|El Sol De La Molina, La Molina, Lima|Lima Departamento|Jirón Lurín, La Molina, Perú|-12.0898444|-76.9021106
$ 824,780|/inmueble/364172|Terreno en  Mala, Cañete, Perú||||PE|Mala, Cañete|Lima Departamento|Mala, Cañete, Perú|-12.6605109|-76.6318419
$ 1,600|/inmueble/498300|Terreno en  Los Olivos, Lima||||PE|Los Olivos, Lima|Lima Departamento||-11.9593005|-77.07602539999999
$ 4,200,000|/inmueble/588150|Terreno en  Av. José Pardo, Miraflores, Lima, Perú||||PE|Santa Cruz, Miraflores, Lima|Lima Departamento|Av. José Pardo, Miraflores, Lima, Perú|-12.1190038|-77.0367566
$ 55,000|/inmueble/587348|Terreno en  San Antonio - Carabayllo, Carabayllo, Perú||||PE|Carabayllo, Lima|Lima Departamento|San Antonio - Carabayllo, Carabayllo, Perú|-11.8612218|-77.0463719
$ 1,199,999|/inmueble/462055|Terreno en  Avenida Petit Thouars 5031, Miraflores, Perú||||PE|Santa Cruz, Miraflores, Lima|Lima Departamento|Avenida Petit Thouars 5031, Miraflores, Perú|-12.1129718|-77.0287027
$ 1,000,000|/inmueble/447937|Terreno en  Lince, Perú||||PE|Risso, Lince, Lima|Lima Departamento|Lince, Perú|-12.0848154|-77.03564519999999
$ 82,000|/inmueble/540059|Terreno en  Chosica, Lima||||PE|Chosica, Lima|Lima Departamento||-11.9687756|-76.8085182
$ 25,000|/inmueble/538753|Terreno en  Q3qg+wv Villa María Del Triunfo, Perú||||PE|Villa El Salvador, Lima|Lima Departamento|Q3qg+wv Villa María Del Triunfo, Perú|-12.210180289444244|-76.92281341062802
$ 130,000|/inmueble/edd7-a1dd-21ae7ecc-882b523a185f-4bdc|Terreno en  Plaza De Armas De Cieneguilla, Cieneguilla, Perú||||PE|La Victoria, Lima|Lima Departamento|Plaza De Armas De Cieneguilla, Cieneguilla, Perú|-12.1122117|-76.816773
$ 2,000|/inmueble/498292|Terreno en  Santiago De Surco, Lima||||PE|Santiago de Surco, Lima|Lima Departamento||-12.1013516|-76.9664664
$ 2,100,000|/inmueble/323035|Terreno en  Av. El Ejército, Miraflores, Perú||||PE|Santa Cruz, Miraflores, Lima|Lima Departamento|Av. El Ejército, Miraflores, Perú|-12.1132974|-77.048418
$ 42,000|/inmueble/d330-a323-14d07fac-485391b499e-4562|Terreno en  Praderas De Lurin, Lurín, Perú||||PE|Lurin, Lima|Lima Departamento|Praderas De Lurin, Lurín, Perú|-12.2628169|-76.8310116
$ 200|/inmueble/498190|Terreno en  Punta Negra, Lima||||PE|Punta Negra, Lima|Lima Departamento||-12.3648751|-76.79454679999999
$ 2,000,000|/inmueble/423818|Terreno en  Pachacamac, Lima||||PE|Pachacamac, Lima|Lima Departamento||-12.233123|-76.8647818
$ 30,000|/inmueble/435531|Terreno en  Carr. Panamericana Sur 102, San Vicente De Cañete, Perú||||PE|San Vicente De Cañete, Cañete|Lima Departamento|Carr. Panamericana Sur 102, San Vicente De Cañete, Perú|-13.2750105|-76.274782
$ 5,027.85|/inmueble/3dd7-92df-ee70626-1d8cfcb2948-1273|Terreno en  Los Olivos, Ancón 15123, Perú||||PE|Ancon, Lima|Lima Departamento|Los Olivos, Ancón 15123, Perú|-11.726159271793573|-77.14764833450317
$ 490,000|/inmueble/411312|Terreno en  Jirón San Ambrosio 415, Lima 15049, Perú||||PE|Barranco, Lima|Lima Departamento|Jirón San Ambrosio 415, Lima 15049, Perú|-12.1433733|-77.0142262
$ 11,000|/inmueble/425740|Terreno en  Mala, Cañete||||PE|Mala, Cañete|Lima Departamento||-12.6620147|-76.6326405
$ 440,180|/inmueble/612725|Terreno en  Pachacamac, Lima||||PE|Pachacamac, Lima|Lima Departamento||-12.2339812|-76.8592309
$ 2,000,000|/inmueble/459382|Terreno en  Santiago De Surco, Lima||||PE|Santiago de Surco, Lima|Lima Departamento||-12.1075323|-76.963899
$ 39,000|/inmueble/fc22-9052-1e2517df-2ba6bb3eca75-3c53|Terreno en  Lurin, Lima|121m2|||PE|Lurin, Lima|Lima Departamento||-12.263857|-76.833487
$ 165,000|/inmueble/387102|Terreno en  Calle Colmenares, 34, La Molina, Lima, Lima, Peru|160m2|||PE|Rinconada Baja, La Molina, Lima|Lima Departamento|Calle Colmenares, 34, La Molina, Lima, Lima, Peru|-12.1111765|-76.94275739999999
$ 78,000|/inmueble/dd76-c020-fd42cbc7-98f224292964-3dc5|Terreno en  Lurin, Lima||||PE|Lurin, Lima|Lima Departamento||-12.2914|-76.853538
$ 75,000|/inmueble/62d3-a4dc-f7d1a4e4-f3510f08fecf-45f3|Terreno en  Moquegua 291, Carabayllo 15321, Perú||||PE|Carabayllo, Lima|Lima Departamento|Moquegua 291, Carabayllo 15321, Perú|-11.894938405167572|-77.0255438428528
(Precio a consultar)|/inmueble/554350|Terreno en  Chilca, Cañete||||PE|Chilca, Cañete|Lima Departamento||-12.5312577|-76.7256537
$ 25,000|/inmueble/454860|Terreno en  Unnamed Road, Chilca 15870, Perú|90m2|||PE|Chilca, Cañete|Lima Departamento|Unnamed Road, Chilca 15870, Perú|-12.507929|-76.755294
